{"accounting_policy":{"artifact_id":"accounting_policy","relative_path":"inputs/accounting_policy.json","sha256":"684c4ada09cc992e12fde122a77a42ffaf86039d44c856a061c9e972f570e2f5","size_bytes":420},"authority_policy":{"artifact_id":"authority_policy","relative_path":"inputs/authority_policy.json","sha256":"76f053820878319d4ee5dfa6ee1f1cffc1776787256518ed166a21a36f87aeb3","size_bytes":342},"evaluation_policy":{"artifact_id":"evaluation_policy","relative_path":"inputs/evaluation_policy.json","sha256":"8443afad53a347663a640fb169c03e4077ce94023ed756944c7b717995a8c701","size_bytes":481},"execution_policy":{"artifact_id":"execution_policy","relative_path":"inputs/execution_policy.json","sha256":"12959cc4457b69633822bad7b01302e596fbca5fa09246fbc85ed5f01cb052c9","size_bytes":623},"instrument_registry":{"artifact_id":"instrument_registry","relative_path":"inputs/instrument_registry.json","sha256":"8613981486a1813cbf780aef46598ac5879a9860d63e5ed1d5f347a7cdf2a83b","size_bytes":215},"inventory_policy":{"artifact_id":"inventory_policy","relative_path":"inputs/inventory_policy.json","sha256":"7c71d8abe66fae3c466af163af93deecf56cf151debb329683dfd6df32f5caf3","size_bytes":330},"oracle_code_snapshot":{"artifact_id":"oracle_code_snapshot","relative_path":"inputs/oracle_code_snapshot.py","sha256":"3c7a059576714e67cbf92e5689c2e88e1f7c600c62dde686a6fa63fb2b7a82c5","size_bytes":144733},"oracle_commit":{"artifact_id":"oracle_commit","relative_path":"oracle_output/COMMIT.json","sha256":"767ce17f67045d98ee3cd91bcea651765adb5fbea1205fa36914c1b2a42f91f2","size_bytes":575},"oracle_contract_snapshot":{"artifact_id":"oracle_contract_snapshot","relative_path":"inputs/oracle_contract_snapshot.json","sha256":"abbdd484354f86a48c8c001fc8521f0cd96ab8aec6b46023f15bcb4502cf4467","size_bytes":17383},"oracle_intent":{"artifact_id":"oracle_intent","relative_path":"oracle_output/intent.json","sha256":"db8b237963d198745f0511ac7d76e5f1fa7c27c38a2e616faaac877bbd9d48df","size_bytes":438},"oracle_ledger":{"artifact_id":"oracle_ledger","relative_path":"oracle_output/oracle_ledger.jsonl","sha256":"fe8520a5b77a37c6cc2b5f22db109fb9094253a714a8ee578831fa46a03e8145","size_bytes":9100},"oracle_manifest":{"artifact_id":"oracle_manifest","relative_path":"oracle_output/oracle_manifest.json","sha256":"6a54ac4568276f6d142db1c9cc264eb089ad3d2f132cf2a5813ba85eef29f3c0","size_bytes":8430},"oracle_request":{"artifact_id":"oracle_request","relative_path":"inputs/oracle_request.json","sha256":"0f240148ae4ea499f6f82b0448800b74433d34f2d3fd04a174ce6d0ef4248052","size_bytes":1777},"oracle_schema_snapshot":{"artifact_id":"oracle_schema_snapshot","relative_path":"inputs/oracle_schema_snapshot.json","sha256":"641c1b8ee69827e078fbcb49cb8f1bc54d59d03fa33f56b42550b8587f99e841","size_bytes":4024},"output_directory":"verifier_output","proposal":{"artifact_id":"proposal","relative_path":"inputs/proposal.json","sha256":"11d4be092b3fb49f523f434b99c2b549a235c58e596bff697fc2c91dfa5d56e8","size_bytes":1099},"reference_code_snapshot":{"artifact_id":"reference_code_snapshot","relative_path":"inputs/reference_code_snapshot.py","sha256":"cbac8e308bc11cd334f1cd23d23e4e75019074c1bdcfb66873b9254e3d6d520f","size_bytes":119541},"reference_contract_snapshot":{"artifact_id":"reference_contract_snapshot","relative_path":"inputs/reference_contract_snapshot.json","sha256":"276c34f4174a15d188406ef870d86a8d0bcbbc1b64b1f45381a033e20eb5d8f5","size_bytes":39759},"schema_version":2,"source_blob":{"artifact_id":"source_blob","relative_path":"inputs/source_blob.jsonl","sha256":"7c2452f81c3b44995529b494a1921c306593474c84b006c75c0c722ee2160b70","size_bytes":796},"source_manifest":{"artifact_id":"source_manifest","relative_path":"inputs/source_manifest.json","sha256":"4dff5e7a10f4c42cfa793d8402e7fa23dd91ec3cd24933f211b7074dad05c963","size_bytes":677}}
